{
  "schema_version": 1,
  "work_id": "nannul",
  "source_candidates": "data/grammatical-terminology-candidates.json",
  "review_guidelines": "docs/GRAMMATICAL_TERMINOLOGY_REVIEW_GUIDELINES.md",
  "layer_status": "review-in-progress",
  "counts": {
    "candidate_surface_forms": 455,
    "reviewed": 137,
    "accepted": 97,
    "rejected": 40,
    "needs_context": 0,
    "unreviewed": 318
  },
  "decisions": [
    {
      "candidate_id": "nannul-term-candidate-4ab35c693be30e13",
      "surface_form_ta": "முன்",
      "decision": "rejected",
      "term_category": null,
      "rationale": "Across the reviewed internal contexts and the three source headings, முன் functions compositionally as the ordinary relational word 'before/in front of' linking phonological or morphological environments. The grammatical rule is technical, but the exact surface form itself is not used as a standalone grammatical technical term.",
      "reviewed_record_ids": [
        "nannul-0089",
        "nannul-0136",
        "nannul-0158",
        "nannul-0205",
        "nannul-0249",
        "nannul-0321",
        "nannul-0165",
        "nannul-0206"
      ],
      "term_use_record_ids": [],
      "non_term_use_record_ids": [
        "nannul-0089",
        "nannul-0136",
        "nannul-0158",
        "nannul-0205",
        "nannul-0249",
        "nannul-0321"
      ],
      "external_evidence": [],
      "review_notes": "The source-heading appearances உயிரீற்று முன் வல்லினம், மெய்யீற்றின் முன் உயிர், and மெய்யீற்றின் முன் மெய் are treated as relational syntax inside technical headings, not termhood for முன் itself.",
      "review_batch": "NANNUL-TERM-REVIEW-001",
      "review_basis": "internal-canonical-contexts-and-source-headings"
    },
    {
      "candidate_id": "nannul-term-candidate-2c83aa9539c00e7c",
      "surface_form_ta": "உயிர்",
      "decision": "accepted",
      "term_category": "phonology-letter-class",
      "rationale": "Nannūl uses உயிர் technically for the vowel class and vowel position in explicit letter/punarcci contexts, including மெய் உயிர் contrasts and உயிர்-initial/final environments. The same exact form also has non-technical living-being/life senses, so acceptance is context-bounded rather than global.",
      "reviewed_record_ids": [
        "nannul-0074",
        "nannul-0147",
        "nannul-0151",
        "nannul-0219",
        "nannul-0242",
        "nannul-0261",
        "nannul-0443",
        "nannul-0204"
      ],
      "term_use_record_ids": [
        "nannul-0147",
        "nannul-0151",
        "nannul-0219",
        "nannul-0242"
      ],
      "non_term_use_record_ids": [
        "nannul-0074",
        "nannul-0261",
        "nannul-0443"
      ],
      "external_evidence": [],
      "review_notes": "The heading மெய்யீற்றின் முன் உயிர் further supports the vowel sense. No claim is made that every occurrence of உயிர் is technical.",
      "technical_scope": "mixed-context",
      "review_batch": "NANNUL-TERM-REVIEW-001",
      "review_basis": "internal-canonical-contexts-and-source-headings"
    },
    {
      "candidate_id": "nannul-term-candidate-21b0ec31ad3bb44d",
      "surface_form_ta": "எண்",
      "decision": "accepted",
      "term_category": "meta-grammar",
      "rationale": "The source explicitly makes எண் an எழுத்து இயல் topic and நூற்பா 57 lists it among the grammatical dimensions to be treated. Other contexts use எண் in grammatical classifications involving numeral forms, while several reviewed occurrences are ordinary counting/enumerative uses; acceptance is therefore context-specific.",
      "reviewed_record_ids": [
        "nannul-0004",
        "nannul-0047",
        "nannul-0057",
        "nannul-0179",
        "nannul-0211",
        "nannul-0249",
        "nannul-0276",
        "nannul-0386",
        "nannul-0420",
        "nannul-0058"
      ],
      "term_use_record_ids": [
        "nannul-0057",
        "nannul-0179",
        "nannul-0249",
        "nannul-0420"
      ],
      "non_term_use_record_ids": [
        "nannul-0004",
        "nannul-0047",
        "nannul-0386"
      ],
      "external_evidence": [],
      "review_notes": "Heading எண் (58–61) is source-supported metalanguage. Remaining unclassified occurrences are not automatically forced into either sense.",
      "technical_scope": "mixed-context",
      "review_batch": "NANNUL-TERM-REVIEW-001",
      "review_basis": "internal-canonical-contexts-and-source-headings"
    },
    {
      "candidate_id": "nannul-term-candidate-033b3c06358ceb1e",
      "surface_form_ta": "ய",
      "decision": "accepted",
      "term_category": "phonology-letter-class",
      "rationale": "The exact form ய is repeatedly used as an explicitly enumerated Tamil letter/consonant symbol and as a member of phonological environments; the source heading ய ர ழ வீறு independently confirms its metalinguistic letter use.",
      "reviewed_record_ids": [
        "nannul-0070",
        "nannul-0149",
        "nannul-0158",
        "nannul-0207",
        "nannul-0353",
        "nannul-0224"
      ],
      "term_use_record_ids": [
        "nannul-0070",
        "nannul-0149",
        "nannul-0158",
        "nannul-0207",
        "nannul-0353",
        "nannul-0224"
      ],
      "non_term_use_record_ids": [],
      "external_evidence": [],
      "review_notes": null,
      "technical_scope": "broad-grammatical",
      "review_batch": "NANNUL-TERM-REVIEW-001",
      "review_basis": "internal-canonical-contexts-and-source-headings"
    },
    {
      "candidate_id": "nannul-term-candidate-c3733c8bd70a111e",
      "surface_form_ta": "வேற்றுமை",
      "decision": "accepted",
      "term_category": "case",
      "rationale": "Nannūl explicitly defines and organizes வேற்றுமை as a case system in பெயரியல் and uses the form technically in case/punarcci and syntactic descriptions. நூற்பா 451 instead uses the ordinary sense 'difference/distinction', so the accepted grammatical sense is bounded to the documented technical contexts.",
      "reviewed_record_ids": [
        "nannul-0152",
        "nannul-0208",
        "nannul-0291",
        "nannul-0361",
        "nannul-0420",
        "nannul-0451"
      ],
      "term_use_record_ids": [
        "nannul-0152",
        "nannul-0208",
        "nannul-0291",
        "nannul-0361",
        "nannul-0420"
      ],
      "non_term_use_record_ids": [
        "nannul-0451"
      ],
      "external_evidence": [],
      "review_notes": "Source heading வேற்றுமை governing 291–319 is direct internal evidence for technical termhood.",
      "technical_scope": "mixed-context",
      "review_batch": "NANNUL-TERM-REVIEW-001",
      "review_basis": "internal-canonical-contexts-and-source-headings"
    },
    {
      "candidate_id": "nannul-term-candidate-6455a8e382cd253b",
      "surface_form_ta": "ர",
      "decision": "accepted",
      "term_category": "phonology-letter-class",
      "rationale": "ர is repeatedly treated as an exact Tamil letter/consonant symbol in letter classification, ending conditions, phonological environments, and the source heading ய ர ழ வீறு.",
      "reviewed_record_ids": [
        "nannul-0070",
        "nannul-0149",
        "nannul-0159",
        "nannul-0224",
        "nannul-0304",
        "nannul-0353"
      ],
      "term_use_record_ids": [
        "nannul-0070",
        "nannul-0149",
        "nannul-0159",
        "nannul-0224",
        "nannul-0304",
        "nannul-0353"
      ],
      "non_term_use_record_ids": [],
      "external_evidence": [],
      "review_notes": null,
      "technical_scope": "broad-grammatical",
      "review_batch": "NANNUL-TERM-REVIEW-001",
      "review_basis": "internal-canonical-contexts-and-source-headings"
    },
    {
      "candidate_id": "nannul-term-candidate-35261cc95184dea4",
      "surface_form_ta": "உருபு",
      "decision": "accepted",
      "term_category": "morphology",
      "rationale": "உருபு is used systematically for grammatical/morphological markers, especially case-related forms, and occurs in explicit source headings on உருபு புணர்ச்சி. The reviewed contexts show it functioning as named grammatical metalanguage rather than ordinary lexical usage.",
      "reviewed_record_ids": [
        "nannul-0179",
        "nannul-0254",
        "nannul-0295",
        "nannul-0356",
        "nannul-0238",
        "nannul-0245"
      ],
      "term_use_record_ids": [
        "nannul-0179",
        "nannul-0254",
        "nannul-0295",
        "nannul-0356",
        "nannul-0238",
        "nannul-0245"
      ],
      "non_term_use_record_ids": [],
      "external_evidence": [],
      "review_notes": "Category morphology is used as the broad analytical bucket; several occurrences are specifically case-marker contexts.",
      "technical_scope": "broad-grammatical",
      "review_batch": "NANNUL-TERM-REVIEW-001",
      "review_basis": "internal-canonical-contexts-and-source-headings"
    },
    {
      "candidate_id": "nannul-term-candidate-f36e8f122d2c2078",
      "surface_form_ta": "ழ",
      "decision": "accepted",
      "term_category": "phonology-letter-class",
      "rationale": "ழ is explicitly used as a Tamil consonant/letter symbol in classification and phonological environments, including the source heading ய ர ழ வீறு.",
      "reviewed_record_ids": [
        "nannul-0070",
        "nannul-0150",
        "nannul-0161",
        "nannul-0224"
      ],
      "term_use_record_ids": [
        "nannul-0070",
        "nannul-0150",
        "nannul-0161",
        "nannul-0224"
      ],
      "non_term_use_record_ids": [],
      "external_evidence": [],
      "review_notes": null,
      "technical_scope": "broad-grammatical",
      "review_batch": "NANNUL-TERM-REVIEW-001",
      "review_basis": "internal-canonical-contexts-and-source-headings"
    },
    {
      "candidate_id": "nannul-term-candidate-12ee4aa6f2f329f5",
      "surface_form_ta": "மெய்",
      "decision": "accepted",
      "term_category": "phonology-letter-class",